<?xml version="1.0" encoding="UTF-8"?>

<School xsi:noNamespaceSchemaLocation="school.xsd" SchoolID="AAAAA"
    xmlns:xsi="http://www.w3.org/2001/XMLSchema-instance">

    <SchoolName>string</SchoolName>
    <SchoolLocation>string</SchoolLocation>


    <Staff StaffID="AAAAB">
        <StaffName>string</StaffName>
        <StaffTitle>string</StaffTitle>
        <StaffCategory>Technical</StaffCategory>
        <Address>
            <Street>string</Street>
            <Suburb>string</Suburb>
            <Postcode>3056</Postcode>
        </Address>
    </Staff>


    <Subject SubjCode="AAAAG">
        <SubjName>string</SubjName>
        <SubjDesc>string</SubjDesc>
        <SubjCapacity>194</SubjCapacity>
        <Staff-Ref ref="ID001" />
    </Subject>


</School>